"Story","Title","Result","Date","Stability","Duration (s)"
"login into TSA.gov","As user I want to login to the TSA.gov application","SUCCESS","2020-02-24T09:39:41.054-05:00[America/New_York]","0.0","16.82"
"Passenger Support section regression test","As user I want to access  pages under Passenger Support section","SUCCESS","2020-02-24T09:39:58.539-05:00[America/New_York]","0.0","79.23"
"TSAPre section regression test","As user I want to access all pages under TSAPre section","SUCCESS","2020-02-24T09:41:22.149-05:00[America/New_York]","0.0","96.88"
"What can I Bring? section regression test","As user I want to access all pages on What Can I Bring? section","SUCCESS","2020-02-24T09:43:05.318-05:00[America/New_York]","0.0","286.49"
"What can I Bring? section regression test","As user I want to access all pages under Special Procedure section","SUCCESS","2020-02-24T09:48:10.394-05:00[America/New_York]","0.0","141.76"
